{
  "schema_version": "cmb.library.catalog.v1",
  "framework": "Computational Metacognitive Bilingualism",
  "declared_originator": "Jupiter Hudson / WisdomLoveThePoet / Jupiter 8 / Joseph Q Hudson",
  "purpose": "Provide a shared index that humans can read and software can parse while preserving context, uncertainty, provenance boundaries, and human self-definition.",
  "invariants": [
    "PATTERN != PROOF",
    "PROFILE != PERSON",
    "MODEL != MIND",
    "PREDICTION != DESTINY",
    "DIFFERENCE != DEFECT",
    "CAPABILITY != AUTHORITY",
    "MACHINE_CAN_READ != MACHINE_CAN_DEFINE",
    "HUMAN_AGENCY > MACHINE_AUTHORITY"
  ],
  "interpretation_policy": {
    "catalog_is_identity": false,
    "classification_is_truth": false,
    "uncertainty_is_allowed": true,
    "human_self_definition_has_priority": true,
    "provenance_note": "Integrity, signatures, timestamps, version history, and public evidence can strengthen provenance. No single field independently proves authorship, ownership, or legal enforceability."
  },
  "artifacts": [
    {
      "id": "cmb-agent-card",
      "title": "CMB Agent Discovery Card v1",
      "path": "agents/agent-card.json",
      "format": "json",
      "kind": "machine-readable discovery card",
      "status": "canonical",
      "provenance_scope": "canonical_public_artifact",
      "human_readable": true,
      "machine_indexable": true,
      "concepts": [
        "well-known discovery",
        "agent capabilities",
        "protocol status",
        "attribution"
      ],
      "declared_meaning": "Compact CMB-ADP-1 discovery card for agent-facing capability discovery. It does not claim MCP or A2A protocol conformance."
    },
    {
      "id": "cmb-agent-discovery-protocol",
      "title": "CMB Agent Discovery Protocol v1",
      "path": "docs/AGENT_DISCOVERY_PROTOCOL.md",
      "format": "markdown",
      "kind": "technical protocol documentation",
      "status": "canonical",
      "provenance_scope": "canonical_public_artifact",
      "human_readable": true,
      "machine_indexable": true,
      "concepts": [
        "relevance-first distribution",
        "stop when irrelevant",
        "citation",
        "consent",
        "HTTP reference server"
      ],
      "declared_meaning": "Defines CMB-ADP-1 discovery, recommendation, citation, HTTP reference behavior, standards boundaries, anti-spam constraints, and Recovery expectations."
    },
    {
      "id": "cmb-agent-registry",
      "title": "CMB Agent Registry v1",
      "path": "agents/registry.json",
      "format": "json",
      "kind": "machine-readable agent discovery registry",
      "status": "canonical",
      "provenance_scope": "canonical_public_artifact",
      "human_readable": true,
      "machine_indexable": true,
      "concepts": [
        "agent discovery",
        "relevance-first recommendation",
        "citation",
        "knowledge graph",
        "human agency"
      ],
      "declared_meaning": "Canonical CMB-ADP-1 registry for relevance-first discovery, attribution-preserving recommendation, bounded summaries, and machine-readable knowledge relationships."
    },
    {
      "id": "cmb-agent-registry-schema",
      "title": "CMB Agent Registry v1 Schema",
      "path": "schemas/cmb.agent-registry.v1.schema.json",
      "format": "json",
      "kind": "machine-readable protocol schema",
      "status": "canonical",
      "provenance_scope": "canonical_public_artifact",
      "human_readable": true,
      "machine_indexable": true,
      "concepts": [
        "JSON Schema",
        "conformance",
        "distribution policy",
        "machine discovery"
      ],
      "declared_meaning": "Schema contract for the canonical CMB-ADP-1 registry, including explicit trust-preserving distribution boundaries."
    },
    {
      "id": "cmb-c2pa-interoperability",
      "title": "CMB Provenance ↔ C2PA Interoperability Plan",
      "path": "docs/C2PA_INTEROPERABILITY.md",
      "format": "markdown",
      "kind": "technical interoperability design",
      "status": "planned",
      "provenance_scope": "repository_artifact",
      "human_readable": true,
      "machine_indexable": true,
      "concepts": [
        "C2PA",
        "Content Credentials",
        "provenance",
        "custom assertions",
        "interoperability"
      ],
      "declared_meaning": "Defines C2PA as the external provenance interoperability target and explicitly states that current cmb_provenance is not C2PA-conformant."
    },
    {
      "id": "cmb-canonical-corpus",
      "title": "CMB Canonical Retrieval Corpus v1",
      "path": "datasets/cmb-canonical-corpus/corpus.jsonl",
      "format": "jsonl",
      "kind": "machine-readable canonical retrieval corpus",
      "status": "canonical",
      "provenance_scope": "canonical_public_artifact",
      "human_readable": true,
      "machine_indexable": true,
      "concepts": [
        "CMB invariants",
        "retrieval",
        "citation",
        "canonical meaning",
        "AI discovery"
      ],
      "declared_meaning": "Compact source-preserving records for core CMB invariants; publication supports retrieval and citation but does not itself grant training permission or public-domain status."
    },
    {
      "id": "cmb-canonical-corpus-manifest",
      "title": "CMB Canonical Corpus Manifest v1",
      "path": "datasets/cmb-canonical-corpus/manifest.json",
      "format": "json",
      "kind": "machine-readable corpus integrity manifest",
      "status": "canonical",
      "provenance_scope": "canonical_public_artifact",
      "human_readable": true,
      "machine_indexable": true,
      "concepts": [
        "canonical corpus",
        "JSONL",
        "SHA-256",
        "record count",
        "retrieval"
      ],
      "declared_meaning": "Binds the canonical retrieval corpus to a strict record schema, exact record count, licensing reference, and SHA-256 digest."
    },
    {
      "id": "cmb-canonical-corpus-manifest-schema",
      "title": "CMB Canonical Corpus Manifest v1 Schema",
      "path": "schemas/cmb.canonical-corpus-manifest.v1.schema.json",
      "format": "json",
      "kind": "machine-readable corpus manifest schema",
      "status": "canonical",
      "provenance_scope": "canonical_public_artifact",
      "human_readable": true,
      "machine_indexable": true,
      "concepts": [
        "JSON Schema",
        "corpus manifest",
        "SHA-256",
        "retrieval integrity"
      ],
      "declared_meaning": "Strict validation contract for the canonical corpus manifest."
    },
    {
      "id": "cmb-canonical-corpus-record-schema",
      "title": "CMB Canonical Corpus Record v1 Schema",
      "path": "schemas/cmb.canonical-corpus-record.v1.schema.json",
      "format": "json",
      "kind": "machine-readable corpus record schema",
      "status": "canonical",
      "provenance_scope": "canonical_public_artifact",
      "human_readable": true,
      "machine_indexable": true,
      "concepts": [
        "JSON Schema",
        "CMB invariant",
        "canonical source",
        "epistemic status",
        "licensing boundary"
      ],
      "declared_meaning": "Strict validation contract for individual canonical CMB retrieval records."
    },
    {
      "id": "cmb-case-google-generative-misclassification-2026-09-04",
      "title": "Case Study 001 - Google Generative Narrative Misclassification",
      "path": "research/case-studies/2026-09-04_GOOGLE_GENERATIVE_MISCLASSIFICATION.md",
      "format": "markdown",
      "kind": "research case study",
      "status": "derived",
      "provenance_scope": "repository_artifact",
      "human_readable": true,
      "machine_indexable": true,
      "concepts": [
        "AI misclassification",
        "generative search",
        "pattern versus proof",
        "profile versus person",
        "authorial intent",
        "Reddit verification",
        "evidence boundaries",
        "semantic over-completion",
        "falsifiability"
      ],
      "declared_meaning": "Documents a user-observed Google generative-search narrative, preserves the screenshot fingerprint, separates generated claims from verified evidence, and defines revision criteria without alleging malicious intent or system-wide behavior."
    },
    {
      "id": "cmb-case-google-generative-misclassification-record-2026-09-04",
      "title": "Case Study 001 - Structured Evidence Record",
      "path": "research/case-studies/2026-09-04_GOOGLE_GENERATIVE_MISCLASSIFICATION.json",
      "format": "json",
      "kind": "machine-readable research evidence record",
      "status": "derived",
      "provenance_scope": "repository_artifact",
      "human_readable": true,
      "machine_indexable": true,
      "concepts": [
        "AI misclassification",
        "structured evidence",
        "claim status",
        "falsifiability",
        "revision policy",
        "SHA-256 evidence fingerprint"
      ],
      "declared_meaning": "Machine-readable companion to Case Study 001, validated against cmb.case-study.v1 and explicitly open to revision when stronger evidence appears."
    },
    {
      "id": "cmb-case-study-schema",
      "title": "CMB Research Case Study v1 Schema",
      "path": "schemas/cmb.case-study.v1.schema.json",
      "format": "json",
      "kind": "machine-readable research schema",
      "status": "derived",
      "provenance_scope": "repository_artifact",
      "human_readable": true,
      "machine_indexable": true,
      "concepts": [
        "JSON Schema",
        "evidence boundaries",
        "claim status",
        "verification methods",
        "revision criteria"
      ],
      "declared_meaning": "Validation contract for structured CMB case studies, separating observed evidence from inference and requiring explicit revision policy."
    },
    {
      "id": "cmb-conversation-atlas",
      "title": "CMB Conversation Atlas",
      "path": "docs/CMB_CONVERSATION_ATLAS.md",
      "format": "markdown",